{
  "schema_version": "agenttrust.evidence/v1",
  "event_id": "evt_conformance",
  "event_sequence": 1,
  "event_type": "tool_intent",
  "run_id": "run_conformance",
  "subject": {
    "actor_id": "alice",
    "tool_call_id": "call_001"
  },
  "payload": {
    "tool_name": "read_file",
    "arguments": {
      "path": "README.md"
    }
  },
  "created_at": "2026-07-13T00:00:00Z",
  "previous_hash": null,
  "event_hash": "sha256:0000000000000000000000000000000000000000000000000000000000000000"
}
